Nagashima Yurie,1993,Makes her debut in with nude self-portraits and nude portraits of her family,,,
Nagashima Yurie,1993,Parco Prize for emerging artists (before graduation in 95),,,
Nagashima Yurie,1996,"Her work is featured in Iizawa Kōtarō, Shutter & Love, which attempted to make sense of the work of women photographers in the 1990s",,,
Nagashima Yurie,1999,Earns her MFA from California Institute of the Arts,,,
Nagashima Yurie,2001,Wins the Kimura Ihee Award (shared w. Hiromix & Ninagawa Mika),,,
Nagashima Yurie,2009,"Publishes a book of biographical short stories, Senaka no kioku",,,
Nagashima Yurie,2010,Wins the Kodansha Essay Award,,,
Nagashima Yurie,2020,"Publishes “Bokura” no “onna no ko shashin” kara watashi no gaariifoto he (From “their"" “Girls Photography” to “our"" ""girlie photography”) (Tokyo: Daifuku shorin)",,,
Hiromix,1995,Wins the 11th New Cosmos of Photography award,,,
Hiromix,2000,Wins the Kimura Ihee Award (shared w. Ninagawa Mika & Nagashima Yurie,,,
Keiko Nomura,1997,Takes part in the Konica New Generation of Photographers grand prix,,,
Keiko Nomura,1999,Wins the Newcomer's Award from the Photographic Society of Japan,,,
Keiko Nomura,2001,Wins the Higashikawa Newcomer's Award,,,
Itō Mari,1976,"Moves with her family from Providence, Rhode Island, USA to Tokyo",,,
Itō Mari,1997,Becomes the first woman photographer to win the Taiyō Award,,,
Itō Mari,1997,Exhibits her work at the Yunnan Museum of Art in China,,,
Okabe Momo,1999,"Awarded the Special Award for “The 8th Exhibition of New Cosmos of Photography selected by Nobuyoshi Araki""",,,
Okabe Momo,2002,Wins the 19th Hitotsubo Ten Prize,,,
Okabe Momo,2013,DILDO (Session press) selected for PHOTOEYE BEST PHOTOBOOK by Hisako Motoo,,,
Okabe Momo,2015,Wins the Paul Huf Award (Amsterdam),,,
Okabe Momo,2012,Publishes Unseen/Tsunami (Dashwood Books),,,
Okabe Momo,2013,Publishes Dildo (Session Press),,,
Okabe Momo,2014,Publishes Bible (Session Press),,,
Okabe Momo,2020,Publishes Irumataru,,,
Ume Kayo,2000,Wins an honourable mention at the 9th New Cosmos of Photography contest for Danshi,,,
Ume Kayo,2001,Wins an honourable mention at the 10th New Cosmos of Photography contest for Joshi chūgakusei,,,
Ume Kayo,2002,Graduates from the Japan Institute of Photography and Film,,,
Ume Kayo,2007,Wins the 32nd Kimura Ihei Award for her first photo book Umeme,,,
Ume Kayo,2006,Publishes Umeme (Little More),,,
Ume Kayo,2007,Publishes Danshi (Little More),,,
Ume Kayo,2008,Publishes Jiichan-sama (Little More),,,
Ume Kayo,2010,Publishes Umeppu (Little More),,,
Shiga Lieko,2001,First solo exhibition Floating Occurrence (LOCATION?),,,
Shiga Lieko,2004,Graduates with a degree in Fine Arts and New Media at the London Institute,,,
Shiga Lieko,2007,Publishes Lilly (Art Beat Publishing); CANARY (Akaaka Art Publ,,,
Shiga Lieko,2009,Publishes Kanariamon (Akaaka Art Publishing),,,
Shiga Lieko,2013,Publishes Rasen Kaigan Shashinshū (Akaaka Art Publishing),,,
Shiga Lieko,2015,"Shiga's work is featured in the exhibition In the Wake, which showcased Japanese photographers' work on the 3/11 disaster",,,
Shiga Lieko,2017,Publishes Blind Date (T&M Project),,,
Takagi Yuriko,1986-1992,"Photographs creative friends, dancers, actors, artists, writers, and poets in Bali, Barcelona, Istanbul, London, Paris, Tokyo",,,
Takagi Yuriko,1994,"Publishes Confused Gravitation (美術出版社, 1994)",,,
Takagi Yuriko,1994,"Publishes Nus intimes (用美社, 1994)",,,
Takagi Yuriko,1995-2010,"Travels to Argentina, Bolivia, Chile, China, India, Indonesia, Hawaii, Namibia, and Okinawa photographing the relationship between gravity and human bodies.",,,
Takagi Yuriko,1998,Publishes Skin : Yuriko Takagi×Kozue Hibino (扶桑社. 1998),,,
Ishikawa Mao,1974,Entered the Workshop School of Photography,,,
Ishikawa Mao,1977,"Held first exhibition, titled Kin no Onnatachi at the Minoruda Photo Space",,,
Ishikawa Mao,1982,"Publishes her first photobook 熱き日々inキャンプハンセン‼︎ (≈ Hot Days in Camp Hansen‼︎). Okinawa: Aman, 1982.",,,
Ishikawa Mao,1983-1990,Opened an izakaya near Aja-Shinko port in Naha and photographed the dockworkers and fishermen who were her customers for her book <i>A Port Town Elegy </i>(1990),,,
Ishikawa Mao,1986,Traveled to Philadelpha and photographed African American communities; these photographs became the book <i>Life in Philly </i>,,,
Ishikawa Mao,1988-1989,"Traveled to the Philippines with dancers she became friends with at bars in Naha, Okinawa. Photographs of them became the self-published book フィリピン「出稼ぎ女性の故郷を訪ねる」 : 石川真生写真集 (Philippines ""Visit to the hometowns of migrant women"") (1989)",,,
,1990,Self publishes 港町エレジー : 石川真生写真集 (Port Town Elegy: Ishikawa Mao). Republished by Zen Photo Gallery in 2015.,,,
Ishikawa Mao,1991,Self publishes 沖縄芝居仲田幸子一行物語 : 石川真生写真集 (An Okinawan Play Sachiko Nakata's story: Mao Ishikawa),,,
Ishikawa Mao,1992,Her work was displayed in the exhibition titled Okinawa: Mirai ni mukete: shashin de kangaeru Okinawa sengoshi ten,,,
Ishikawa Mao,1990s-2000s,Took photographs for and wrote columns for the <i>Okinawa Times</i> and <i>Ryukyu Shimpo</i>,,,
Ishikawa Mao,2010,"Awarded the Sagamihara Photo Awards for her book FENCES, OKINAWA (Tokyo: Miraisha, 2010)",,,
Ishikawa Mao,1993-2011,"Took portraits and gathered interviews with people from Japan, Taiwan, and mainland China <i>Here’s What the Japanese Flag Means to Me </i>(日の丸を観る目) (2011)",,,
Ishikawa Mao,1995,"Publishes 女性カメラマンがとらえた沖縄と自衛隊 (Okinawa and the Self-Defense Forces captured by a female photographer) (Tokyo, Koubunken)",,,
Ishikawa Mao,1996,Publishes これが沖縄の米軍だ : 基地の島に生きる人々 (This is the U.S. Army in Okinawa: People Living on a Base Island) (Koubunken),,,
Ishikawa Mao,2002,"Publishes 沖縄ソウル / Okinawa Soul (Ohta Publishing), reflections on her work in photography.",,,
Ishikawa Mao,2004,"Takes part in group exhibition  ""The Perpetual Moment –Visions from within Okinawa and Korea, MoMA PS1"" (October 2004 – December 2004)",,,
Ishikawa Mao,2006,Publishes シマが揺れる : 沖縄・海辺のムラの物語 (The Island SHakes: Okinawa ・The Story of a Seaside Village) with text by journalist and historian Urashima Etsuko (Koubunken),,,
Ishikawa Mao,2008,"Takes part in group exhibition ""Okinawa Prismed 1872–2008, The National Museum of Modern Art Tokyo"" (October 2008 – December 2008)",,,
Ishikawa Mao,2010,"Publishes Fences, Okinawa : 石川真生写真集 (Fences, Okinawa: Ishikawa Mao) (Miraisha)",,,
Ishikawa Mao,2010,"Publishes Life in Philly (Tokyo: Zen Foto Gallery / Gallery OUT of PLACE, 2010)",,,
Ishikawa Mao,2011,"Yokohama Museum of Art features her work in ""原田正路／石川真生 (Harada Masamichi／Ishikawa Mao)"" (December 2011 – March 2012)",,,
Ishikawa Mao,2012,"Her photographs are featured in 沖縄とヤマト : 「縁の糸」をつなぎ直すために (Okinawa and Yamato: To reconnect the ""thread of connection"") (Kamogawa)",,,
Ishikawa Mao,2013,"Her photographs are featured in ""All You Need is Love"" Mori Art Museum (April 2013 – September 2013)",,,
Ishikawa Mao,2013,"Yokohama Citizen's Gallery Azamino exhibition ""写真家石川真生 : 沖縄を撮る (Ishikawa Mao: Photographing Okinawa)"" and catalogue by the same name (Yokohama Citizen's Gallery Azamino)",,,
Ishikawa Mao,2014,Publishes 森花―夢の世界 (Morika’s Dreams) (Tokyo: Miraisha),,,
Ishikawa Mao,2015,"Zen Photo Gallery holds exhibition of her work, ""A Port Town Elegy"" (March 2015)",,,
Ishikawa Mao,2017,"Publishes Red Flower: The Women of Okinawa (New York: Session Press, 2017)",,,
Ishikawa Mao,2018,"Her photographs are featured in the 9th Asia Pacific Triennal of Contemporary Art (APT9), Queensland Art Gallery (November 2018 – April 2019)",,,
Ishikawa Mao,2020,"Her photographs are featured in ""TOP Collection: Photography in the Ryukyu Islands,"" Tokyo Photographic Art Museum (September 2020 – November 2020)",,,
Kon Michiko,1978,"After graduating from the Department of Graphic Arts School of Art and Design, enters the Tokyo Photography College and graduates in 1980",,,
Kon Michiko,1984,Wins a scholarship award at the Kanagawa Prefectural Art Exhibition,,,
Kon Michiko,1985,Exhibits Still at the Shinjuku Nikon Salon (Tokyo),,,
Kon Michiko,1987,"EAT Imamichiko Photo Exhibition at the Kodak Photo Salon (Tokyo, Osaka); Wins the novice award at the Higashikawa International Festival",,,
Kon Michiko,1987,"Publishes photographs in Eat (The Artworks Commitee), Republished by Shogakukan in 1991",,,
Kon Michiko,1990,Exhibits EAT: Recent Works at P.G.I. Toranomon (Tokyo); MICHIKO KON at Iwafusa (Tokyo); 今道子 at Picture Photo Space (Osaka),,,
Kon Michiko,1991,"Wins the Kimura Ihee Award and exhibits 16th Kimura Ihei Photo Award Exhibition Kon Michiko-EAT at the Minolta Photo Space (Tokyo, Osaka); photographs are featured in Make-believe : contemporary photography from Japan (Photographers' Gallery); New Japanese Photography Vol.2 Kon Michiko Exhibition Exposure Shibuya Parco Part II (Tokyo)",,,
Kon Michiko,1992,"Exhibits Michiko Kon: Still Lives MIT List Visual Arts Center (USA) (Circuit: Virginia Museum (USA); Publishes Michiko Kon : still lives (MIT List Visual Arts Center), republished by Aperture in 1997; Michiko Kon Imamichiko (Tokyo)",,,
Kon Michiko,1993,Michiko Kon: Still Lives at the Virginia Museum (USA),,,
Kon Michiko,1994,"Still Lives Still, P.G.I. Toranomon (Tokyo)",,,
Kon Michiko,1995,"Exhibits Michiko Kon at Robert Mann Gallery (USA); KON Michiko, Ichibo (Tokyo); Still Lives, Gallery Isis (Kyoto);""Kon Michiko Photo Exhibition Stills, Picture Photo Space (Osaka); Taipei Photo Exhibition by Kon Michiko, Taipei Photo Gallery (Taiwan)",,,
Kon Michiko,1996,"Publishes 1996 <i>KON BOX</i> (Photo Gallery International & Natsuraeri Press); Exhibits Kon Michiko Exhibition by Polaroid Color 8x10 Polaroid Gallery (Tokyo); Work included in the exhibition ニュー・ジャパニーズ・フォトグラフィ1990's : 無意識の共鳴/New Japanese photography in 1990's : the resonance of unconsciousness, Yokohama Shimin Gallery",,,
Kon Michiko,1997,"Publishes Kon Michiko (Korinsha); Michiko Kon: Still Lives (Aperture); Kon Michiko Photobook Publication Commemorative Exhibition, P.G.I. Shibaura (Tokyo)",,,
Kon Michiko,1998,"Exhibits Photographs 1998, P.G.I. Toranomon (Tokyo); Still, Gallery Raku, Kyoto University of Art and Design (Kyoto)",,,
Kon Michiko,1999,"<i>STILL LIFES</i> Baden Gallery (USA); Michiko Kon 今 道子, Kōbō (Tokyo)",,,
Kon Michiko,2002,<i>KON MICHIKO 今 道子</i>,,,
Kon Michiko,2008,"Exhibits Platinum Print Collection,<i> </i>P.G.I. (Tokyo)",,,
Kon Michiko,2009,"Exhibits Michiko Kon Platinum Prints,<i> </i>Michel Soskine Inc. (Spain)",,,
,2010,"Solo exhibition Kon Michiko's Exhibition of Gold Works, 泰吉軒/Timeless Gallery (China)",,,
Kon Michiko,2011,"Publishes IMPACT (M/Light); Exhibits 今道子 Kon Michiko, Kōbō (Tokyo)",,,
Kon Michiko,2012,"Kon Michiko Photo Exhibition IMPACT, B GALLERY (Tokyo); Kon Michiko New Exhibition IMPACT,<i>  </i>",,,
Kon Michiko,2014,"Exhibits Recent Works, Photo Gallery International <P.G.I.> (Tokyo)",,,
Kon Michiko,2016,"Exhibits Exposición fotográfica de Michiko Kon, Veracruz State University Library (Mexico)",,,
Kon Michiko,2017,"Naturaleza Muerta at the Mexico National Museum of Photography Fototeca (Mexico);""Michiko Kon"" Michel Soskine Inc. (Spain)",,,
Kon Michiko,2018,Recent Works Photo Gallery International <P.G.I.> (Tokyo),,,
Kon Michiko,2019,"Solo exhibition Kon Michiko, Kōbō (Tokyo); ""Reviving Things"" Fujifilm Square Photo History Museum (Tokyo); ""Cannibal Feast"" Robert Man Gallery (USA)",,,
Kon Michiko,2021,Philia-Kon Michiko<i> </i>at the Kanagawa Prefectural Museum of Modern Art Kamakura Annex (Kanagawa),,,
Kon Michiko,2022,Wins the Photographic Society of Japan Award,,,
Satō Nanako,1977,"Makes her debut as a musician with the album ""Funny Walking"" (Columbia Japan)",,,
Satō Nanako,1979,Releases four albums by this date and collaborated with the Moon Riders and Kazuhiko Kato,,,
Satō Nanako,1980,"Forms the new wave band ""SPY""",,,
Satō Nanako,1980,"After releasing the album ""SPY"" turns her attention to photography, experimenting with multiple exposures and began working as a professional photographer in advertising",,,
Satō Nanako,1984,"Publishes 石田えり写真集－勝手に、TOO LATE (Ishida Eri, TOO LATE)（集英社　1984年3月）",,,
Satō Nanako,1986,Won the World Calendar Contest Gold medal,,,
Satō Nanako,2004,Photographs for the album The Bird （河出書房新社　2004年4月）,,,
Satō Nanako,2006,Publishes 光の旅ー釈迦如来MANDALA and 8・15 OKINAWA Cocco　(NHK出版),,,
Kamikura Yoshiko,1990,"<i>Naturita</i> (アルファベ−タ, Tokyo) and wins the Photographic Society of Japan New Face Award",,,
Kamikura Yoshiko,1998,Publishes 「たまゆら」（マガジンハウス）,,,
Kamikura Yoshiko,2002,Publishes「たまもの」（筑摩書房）,,,
Kamikura Yoshiko,2004,"Publishes 絶対毎日スエイ日記 (アートン), with Suei Akira, whose diary of their relationship is accompanied by Kamikura's photographs",,,
Kamikura Yoshiko,2015,Publishes「たまきはる」（リトルモア）,,,
Oshida Miho,2010,"Exhibits 「迷宮のプラハ そして冬の旅」(The Labyrinth of Prague and Winter Journey) (Canon Gallery, Ginza)",,,
Oshida Miho,2014,"Exhibits Winter Journey II Auschwitz and Majdanek (Canon Gallery, Ginza)",,,
Oshida Miho,2019,Oshida Miho Photograph Exhibition at the Ginza Okuno Buidling Room 306 Project,,,
Yoneda Tomoko,1989,Earns a BFA in Photography at the University of Illinois at Chicago,,,
Yoneda Tomoko,1991,"Earns her MA in Photography from the Royal College of Art, London; Participates in the group exhibition Treading a Fine Line – 8 Contemporary women photographers (Zelda Cheatle Gallery, London)",,,
Yoneda Tomoko,1992,"Group exhibition, The Big Apple (Zelda Cheatle Gallery, London)",,,
Yoneda Tomoko,1993,"Group exhibition, The Daily Planet (Transmission Gallery, Glasgow)",,,
Yoneda Tomoko,1996,"Group exhibition, Future Vision (The Photographers’ Gallery, London)",,,
Yoneda Tomoko,1997,"Solo exhibition Topographical Analogy (Zeit-Foto Salon, Tokyo)",,,
Yoneda Tomoko,1998,"Group exhibition, 21st Anniversary ZEIT-FOTO (Artspace Shimoda, Tokyo)",,,
Yoneda Tomoko,1999,"Solo exhibition, Luminary (Room, Gentilly, France): Participates in two group exhibitions: The Vision of Contemporary Art (The Ueno Royal Museum, Tokyo) and    Zeitgenössische Fotokunst Aus Japan (Neuer Berliner Kunstverein (NBK), Berlin, also toured 3 other museums in Germany)",,,
Yoneda Tomoko,2000,"Solo exhibition, Between Visible and Invisible (Zeit-Foto Salon, Tokyo); Tomoko Yoneda Zelda (Cheatle Gallery, London); Group exhibition: Counter-Photography – Japan’s Artists Today (Moscow Arts Centre, Moscow, and touring in Russia, Scandinavia, Europe, and Asia)",,,
Yoneda Tomoko,2001,"Participated in the group exhibitions: BetweenVisible and Invisible (The Museum of Contemporary Photography, Columbia College Chicago, Chicago; Sanya Photography Gallery, Shanghai   Artists’ debut, Rice gallery by G2, Tokyo), Summer Show – Three Contemporary Photographers (Zelda Cheatle Gallery, London), Kiss In the Dark – Contemporary Japanese Photography (Tokyo Metropolitan Museum of Photography) and Marugame Genichiro-Inokuma Museum of Contemporary Art, Marugame, Kagawa; Painterly Photography (Blains Fine Art, London), Surface (Nederlands Foto Institute, Rotterdam)",,,
Yoneda Tomoko,2002,"Group exbhition: Fragilités – Printemps de Septembre (Toulouse and Centre de Photographie de Lectoure, Lectoure)",,,
Yoneda Tomoko,2003,"Holds two solo exhibitions: Scene - Collective Forgetting (Zelda Cheatle Gallery, London) and  Beyond Memory and Uncertainty (Shiseido Gallery, Tokyo); Participates in the group exhibitions: History of Japanese Photography 1854-2000 (The Museum of Fine Arts, Houston), My Room Somehow Somewhere (Graf Media GM, Osaka),  The Year of New Work: Contemporary Asian Photography (The Japan Society, New York), Mask of Japan: Japanese Contemporary Photography (Aura Gallery, Shanghai)",,,
Yoneda Tomoko,2004,"Group exhibitiions: Out of the Ordinary/Extraordinary: Japanese Contemporary photography (Japan Cultural Institute in Cologne (The Japan Foundation)), touring in Europe and USA   Non-Sect Radical: Contemporary Photography III (Yokohama Museum of Art Spread in Prato, Dryphoto arte contemporanea, Prato, Italy)",,,
Yoneda Tomoko,2005,"Three solo exhibitions: A Decade After (Ashiya City Museum of art and History, Ashiya); After Amnesia: Scenes of Conflict That Have Forgotten Their Past (Daiwa Foundation, London);   After the Thaw (ShugoArts, Tokyo); Group exhibitions: YOKOHAMA 2005: International Triennale of Contemporary Art: Art Circus - Jumping from the Ordinary (Yokohama), From East and West (SHUGOARTS, Tokyo)",,,
Yoneda Tomoko,2006,"Solo exhibition: Monochrome Works 1996-2003 (ShugoArts, Tokyo); Group exhibitions: Temporary Art Museum (SOI SABAI, Silpakorn University, Bangkok),   Berlin-Tokyo/Tokyo-Berlin (Neue Nationalgalerie, Berlin), Naturaleza, PHotoEspaña 2006 (Madrid, touring in Tenerife (Exhibition title: The Rising Sun),   85/05:The Photography beyond 20 years from Tsukuba Museum of Photography 1985 (Sendai Mediatheque, Sendai), YOSHITOMO NARA + graf A to Z (Yoshii Brick Brewhouse, Hirosaki)",,,
Yoneda Tomoko,2007,"Group exhibitions: The 10th International Istanbul Biennial, Not only possible, but also necessary: Optimism in the age of global war (Istanbul); Beautiful New World: Contemporary Visual Culture from Japan (B.T.A.P, Beijing; Guangdong Museum of Art, Guangzhou); La Biennale di Venezia, The 52nd International Art Exhibition: Think with the Senses - Feel with the Mind. Art in the Present Tense (Venice); FASCINATION (Nihonbashi Takashimaya Gallery X, Tokyo); Paradise is for the blessed (Four Corners, London) Changing Faces/Work (Stedelijk Museum de Lakenhal in Scheltema, Leiden, touring in Europe, Museu Valencià de la Il.lustració i de la Modernitat (MuVIM), Valencià, Dom Fotografie, Liptovský Mikuláš); Japan Caught by Camera - Works from the Photographic Art in Japan (Shanghai Art Museum)",,,
Yoneda Tomoko,2008,"Solo exhibiton: An End is a Beginning (Hara Museum of Contemporary Art, Tokyo); Group exhibitions: The 13th Asian Art Biennale, Bangladesh 2008, “What a Place Tells Us” Exhibition by Tomoko Yoneda and Yoshihiro Suda (Osmani Memorial Hall, Bangladesh Shilpakala Academy, Bangladesh National Museum, Bangladesh); MOGI Kenichiro, hana, KAKUTA Mitsuyo, ARAKI Nobuyoshi: Four Views of the Collection of the Yokohama Museum of Art (Yokohama Museum of Art, Yokohama)",,,
Yoneda Tomoko,2009,"Holds two solo exhibitions: Rivers Become Oceans (ShugoArts, Tokyo) and    Beyond Memory and Uncertainty (Sage Paris, Paris); Group exhibitions: Rememory (Galerie Lucy Mackintosh, Lausanne); Art Tells the Times, Works by Women Artists : Shiseido Gallery 90th Anniversary Exhibition (Shiseido Gallery, Tokyo); Platform 2009 (KIMUSA, Seoul); “What a Place Tells Us” Exhibition by Tomoko Yoneda and Yoshihiro Suda(The 13th Asian Art Biennale, Bangladesh 2008 Traveling Exhibition) (100Tonson Gallery, Bangkok)",,,
Yoneda Tomoko,2010,"Participates in the group exhibitions: The 20th Festival of Le Printemps de Septembre (Musée Henri-Martin, Cahors);    Kuandu Biennale ""Plus:10+10-Memories and Beyond"" (Kuandu Museum of Fine Arts, Taipei); The Definition of Self (21_21 Design Sight, Tokyo);   Roppongi Crossing 2010 Can There Be Art (Mori Art Museum, Tokyo); Plastic Memories (Museum of Contemporary Art Tokyo, Tokyo); New Photography: Pavilion Commissions 2009 (Djanogly Art Gallery, Nottingham)",,,
Yoneda Tomoko,2011,"Solo exhibition Japanese House (ShugoArts, Tokyo); Group exhibitions: What is “On the Agenda of the Arts”? (Tokyo Wonder Site, Shibuya);   Collection Exhibition 2011−2 To Build, To Depart, Hiroshima Imagined (Hiroshima Museum of Contemporary Art); Art in an Office (Toyota city Museum of Art, Toyota, Aichi);   Bye Bye Kitty!!! Between Heaven and Hell in Contemporary Japanese Art (Japan Society)",,,
Yoneda Tomoko,2012,"Participates in the group exhibitions: Sky over My Head (Contemporary Art Museum, Kumamoto, Japan); The Best of Times, The Worst of Times. Rebirth and Apocalypse in Contemporary Art (Kiev Biennale Arsenale);   Tokyo Story (Tokyo Wonder Site, Shibuya)",,,
Yoneda Tomoko,2013,"Solo exhibition We shall meet in place where there is no darkness at the Tokyo Metropolitan Museum of Photography and Himeji City Museum of Art (Himeji, Japan); Group exhibitions: Awakening―Where are we standing?: Earth, Memory and Resurrection (Aichi Triennale 2013, Aichi, Japan); Unattained Landscape (The Bevilacqua La Masa Foundation, Venice); Re: Quest – Japanese Contemporary Art Since the 1970s (Seoul National University Museum of Art, Seoul, Korea)",,,
Yoneda Tomoko,2014,"Participates in the group exhibitions: Burning Down the House: The 10th Gwangju Biennale (Gwangju, Korea   SeMA Biennale Mediacity Seoul, Seoul Museum of Art, Seoul, Korea); 20 years since Hanshin-Awaji earthquake (Hyogo Prefectural Museum, Kobe, Japan)",,,
Yoneda Tomoko,2015,"Solo exhibition: Beyond Memory (Grimaldi Gavin, London); Group exhibitions: Nissan Art Award 2015 Exhibition of New Works by Seven Finalists (BankART Studio NYK, Yokohama, Japan);   Discordant Harmony: Critical Reflection on the Imagination of Asia (Hiroshima City Museum of Contemporary Art, Hiroshima, Japan); Variations Corbusier (Centre international D'Art Contemporain Alpes-Maritimes, France)",,,
Yoneda Tomoko,2016,"Group exhibitions: Discordant Harmony: Critical Reflection on the Imagination of Asia (Kuandu Museum of Fine Arts, Taipei, Taiwan);   Tell Me A Story: Locality and Narrative (Rockbund Art Museum, Shanghai, China)",,,
Higashi Yumi,1969,"Higashi and 20 other members of the Jissen Women's College photography club repeatedly returned to the town of Ashio to live with and photograph the community as the mine closed from 1969-1971. They took photographs as a part of ""group shooting"" where all images were anonymously made",,,
Higashi Yumi,1994,Participates in publishing「集団撮影行動　足尾」(Group Shooting Action: Ashio)   (集団撮影行動足尾を出版する会）,,,
Higashi Yumi,2006,Participates in the exhibition 「足尾グループ写真展」（足尾歴史館）,,,
Higashi Yumi,2009,Participates in the exhibition 「足尾今昔写真展　銅山閉山前・そして今」　（足尾歴史館）,,,
Higashi Yumi,2017,"Participates in the creation of the All Japan Student Photo Club webiste もう一つの写真記録」(aajps.or.jp)（全日本写真連盟OB.OG）as a place to make the digitzed collections of photo books, newsletters, and photographs of the group publicly accessible; Participates in the exhibition 「足尾今昔写真展　1973年　（昭和48）”足尾”」 （足尾歴史館）",,,
Higashi Yumi,2018,Participates in the exhibition「足尾・谷中　そして移民のサロマベツ原野　写真展」（足尾歴史館）,,,
Tobu Akiko,1997,"1997 Began practicing photography, training with Hatakeyama Naoya",,,
Tobu Akiko,2003,"Publishes The Hotel Upstairs (Studio Parabolica); Exhibits The Hotel Upstairs (Zeit-Foto Salon, Tokyo)",,,
Tobu Akiko,,"2004 Wins the Higashikawa New Photographer Prize; 20th HIgashikawa Awards Exhibition (Higashikawa Bunka Gallery, Hokkaido)",,,
Tobu Akiko,2005,"Exhibits ""Memoraphilia"" (Zeit-Foto Salon, Tokyo); Takes part in the group exhibition ""85/05: Photography Beyond 20 years from the Tsukuba Museum of Photography 1985"" (Sendai Mediatheque, Miyagi); ""PRESENCE: Katherine Westerhout, Akiko Tobu, Dayanita Singh"" (SEPIA International and the Alkazi Collection of Photography, New York)",,,
Tobu Akiko,2006,"Takes part in the group exhibition ""SEPIA at Seven"" (SEPIA International and the Alkazi Collection of Photography, New York)",,,
Tobu Akiko,2007,"Exhibits ""Hikariba"" (Zeit-Foto Salon, Tokyo); Takes part in the group exhibition ""Japan Caught by Camera: Works from the Photographic Art in Japan"" (Shanghai Art Museum, Shanghai)",,,
Tobu Akiko,2008,"Takes part in the group exhibition ""The history of arts and cities--Paris, New York, Tokyo, and Shanghai"" (Sendai Mediatheque, Miyagi)",,,
Tobu Akiko,2009,"Exhibits ""contemporary photography #1 Akiko Tobu 'at zero'"" (Gallery ZERO at Meiji University Library, Ikuta, Kanagawa)",,,
Tobu Akiko,2010,"Takes part in the group exhibition ""SUMMIT OF THE SIX"" (Vanguard Gallery, Shanghai)",,,
Watanabe Fujie,1940,Works for the Ministry of Foreign Affairs Photo Agency distributing photographs to domestic and international news agency to promote Japan,,,
Watanabe Fujie,1945,Is working for the Mainich Shimbun when the war ends and she resigns,,,
Watanabe Fujie,1950,"In the 1950s she works as an event photographer with a team of four male assistants often printing up to 3,000 photographs in two nights for her customers",,,
Takahashi Chiyo,1937,Lives in Manchuria for a year,,,
Takahashi Chiyo,1945,Begins working for Kyodo News Agency,,,
Kumagai Kazuyo,1952,Graduates from photography school,,,
Kumagai Kazuyo,1952,Begins freelancing as a commercial photographer for a chemical product company and working part time with Konishi Roku,,,
Ogawa Chieko,1957,From 1957-1962 is featured in photo magazine articles about the experiences and perspectives of professional women photographers. In the 1950s works as a free lance photographer.,,,
