Takahashi Junko,1985,Graduates from Musashino Art University,,,
Takahashi Junko,1989,First solo exhibition is held at Kobayashi Gallery (Tokyo),,,
Takahashi Junko,1990,"Two solo exhibitions: ジョーンズ氏の肖像 (Portrait of Mr. Jones) at Kaneko Art G1 (Tokyo), and ポリ=プラ=スクラップ (Poly=Pla=Scrap) at Mole (Tokyo)",,,
Takahashi Junko,1992,Wins the 5th Canon New Cosmos Award of Excellence for 記憶の絵 (Pictures of Recollection),,,
Takahashi Junko,1993,"Holds a solo exhibition, Ontology, at Gallery+1 (Tokyo)",,,
Takahashi Junko,1995,"Holds a solo exhibition, Heart Beat, at Konica Plaza (Tokyo)",,,
Takahashi Junko,1996,"Publishes her first photobook, a hybrid analogue and CD-ROM photobook, entitled Another Sight (Inner Brain); A solo exhibition of the same series is held at Mole gallery (Tokyo)",,,
Takahashi Junko,1998,"Publishes スクールダズ (School Days) (Shinchosha), Y's Eyes (Yomiuri TV), and Trans Body Bondage (Wailea Press)",,,
Takahashi Junko,2002,"Her work is included in the group exhibition 写真新世紀１０周年記念展 Futuring Power (Futuring Power: 10th Anniversary of New Cosmos of Photography), held at the Tokyo Metropolitan Museum of Photography (Tokyo); she also holds a solo exhibition, cool & heat, at Sho-ART (Tokyo)",,,2002-2003
Takahashi Junko,2006,Publishes The Receptionist (Nazraeli Press),,,
Takahashi Junko,2008,"Her work is included in the group exhibition 日本の新進作家展 vol.7「オン・ユア・ボディ」(On Your Body: Contemporary Japanese Photography Vol.7), held at the Tokyo Metropolitan Museum of Photography (Tokyo); two solo exhibitions: The Receptionist—Tokyo Mid, at LOTUSROOT Gallery (Tokyo), and wreck, at moriokashoten (Tokyo)",,,
Takahashi Junko,2011,"Solo exhibition: LOST WORLD held at Three Shadows Art Photography Center in Beijing, China",,,
Takahashi Junko,2012,"Solo exhibition: Fade Out Changdian / LOST WORLD, held at Shinjuku Nikon Salon (Tokyo)",,,
Onodera Yuki,DATE TK,Graduates from Kuwazawa Design School,,,
Onodera Yuki,1991,Wins the 1st New Cosmos of Photography Award,,,
Onodera Yuki,1992,"Her work is included in the group exhibition, 第1回・写真新世紀 (The 1st New Cosmos of Photography), held at P-3 Art and Environment Gallery (Tokyo)",,,
Onodera Yuki,1993,"Moves to Paris and establishes her own studio; holds her first solo exhibition, 白と玉 (White and Sphere), at Gallery Hosomi (Tokyo)",,,
Onodera Yuki,1995,"Holds three solo exhibitions of her DOWN series in Tokyo at three different galleries, and one solo exhibition in Paris, entitled 古着のポートレート (Portrait of Second-Hand Clothes), at L'Institut Français de la Mode (Paris)",,,
Onodera Yuki,1996,"Wins the 21st Kodak Photo Critic Award, and is included in the exhibition celebrating the same awards, held at the Galerie Passage de Retz (Paris), along with three other group exhibitions and one solo exhibition in Paris.",,,
Onodera Yuki,1997,"Two solo exhibitions in France, held at the Galerie Laage-Salomon (Paris) and the   Galerie du Théâtre Granit (Belfort); Her work is also included in two Japanese group exhibitions, including the 第2回東京国際写真ビエンナーレ 展 ( ノミネート部門日本代表参加 (The 2nd Tokyo International Photo-Biennale / Nomination Section) at the Tokyo Metropolitan Museum of Photography (Tokyo).",,,
Onodera Yuki,1998,"Her work is included in eight group exhibitions internationally, including Moscow, Tokyo, France, and the United States of America.",,,
Onodera Yuki,1999,"She exhibits in three solo exhibitions in Japan: a solo exhibition at the Museum of Modern Art in Gunma, “C.V.N.I.“ at Galerie il tempo (Tokyo), and “P.N.I.“ at Zeit-Photo Salon (Tokyo); Her work is also included in four international group exhibitions in Germany, the USA, and France.",,,
Onodera Yuki,2000,"Solo exhibition at the Galerie du Théâtre Granit (Belfort, France); Her work is also included in six international group exhibitions in France, Germany, China, and the USA.",,,
Onodera Yuki,2001,"She recieves the 17th Higashikawa Award for young artists. Two solo exhibitions in Tokyo: 真珠のつくり方 (How to Make a Pearl) at Zeit-Foto Salon (Tokyo), and 窓の外を見よ (Look Out the Window) at Galerie il Tempo (Tokyo); Her work is also included in four international group exhibitions in Sweden and Japan.",,,
Onodera Yuki,2002,"Wins the Photographic Society of Japan beginners' award; Publishes 真珠のつくり方 (How to Make a Pearl)  (Nazraeli Press) and カメラキメラ (CameraChimera) (Suiseisha); The solo exhibitions  真珠のつくり方 (How to Make a Pearl) and 窓の外を見よ (Look Out the Window) travel to Paris, while two more solo exhibitions open in Tokyo: transvest at Zeit-Foto Salon, and ミツバチ – 鏡 (Bees — Mirror) at Galerie il Tempo; Her work is included in a dozen international group exhibitions in Sweden, Japan, Norway, Finland, Latvia, France, and Japan, including 写真新世紀１０周年記念 (The New Cosmos of Photography 10th Anniversary) at The Tokyo Metropolitan Museum of Photography (Tokyo).",,,
Onodera Yuki,2003,"Wins the Kimura Ihei award; Holds one solo exhibition in Paris and her work is featured in five international group exhibitions in Japan, China, and France.",,,
Onodera Yuki,2004,"Publishes the photobook transvest (Nazraeli Press); Three solo exhibitions in Paris and Tokyo; Her work is also included in seven international group exhibitions in Spain, China, Japan, and Germany, including 六本木クロッシング：日本美術の新しい展望 (Roppongi Crossing: New Visions in Japanese Art) at the Mori Art Museum (Tokyo).",,,
Onodera Yuki,2005,"Multiple solo exhibitions, including at the National Museum of Art in Osaka, Japan, and dozens of international group exhibitions.",,,
Onodera Yuki,2006,Wins the Niépce Award; Participates in multiple international group and solo exhibitions.,,,
Onodera Yuki,2007,"Exhibits in dozens of solo and group exhibitions across the globe, including shows in Paris, Tokyo, Korea, Germany, China, Iceland, and the USA, among others.",,,
Onodera Yuki,2008,"Exhibits in dozens of solo and group exhibitions across the globe, including shows in Paris, Tokyo, Korea, Germany, China, and Luzembourg, among others.",,,
Onodera Yuki,2009,"Exhibits in multiple solo and group exhibitions across the globe, including shows in Paris, Tokyo, Korea, Colombia, Germany, the USA, and Greece, among others.",,,
Onodera Yuki,2010,"Holds a solo exhibition of her work,「写真」の迷宮へ (Yuki Onodera: Into the Labyrinth of Photography), at the Tokyo Metropolitan Museum of Photography; Exhibits in numerous other solo and group exhibitions across the globe, including shows in France, Japan, and China.",,,
Onodera Yuki,2011,Wins the Minister of Education Award for Fine Arts; Wins the 27th Higashikawa Prize; Her career trajectory of numerous international solo and group exhibitions continues through the second decade of the 21st century.,,,
Onodera Yuki,2014,Publishes 11番目の指 (Eleventh Finger) (art beat publishers),,,
Nakamura Haruko,1984,"Nakamura graduates from Nihon University in the photography division of the Department of the Arts; Following her graduation, she travels to Tanzania for six months.",,,
Nakamura Haruko,1989,Publishes 世界の子どもたちタンザニア(Children of the World: Tanzania) (Kaiseisha),,,
Nakamura Haruko,1991,"Her first solo exhibition, 太陽と風のワトト (Watoto of the Sun and the Wind), is held at El Park Sendai (Miyagi)",,,
Nakamura Haruko,1993,Travels to Tuscany and starts a project photographing landscape and scenery.,,,
Nakamura Haruko,1995,"Her solo exhibition, 魚を売るイネさん (Mrs Ine Selling Fish) is held at El Park Sendai (Miyagi)",,,
Nakamura Haruko,1999,Her solo exhibition うみから・・・(From the Sea) is held at Gallery Arata (Miyagi),,,
Nakamura Haruko,2000,"Wins New Cosmos of Photography Grand Prix Award for her work 海からの贈り物 (The Gift from the Sea); Also wins the 21st Annual New Century of Photography Excellence Award, as selected by photographer Araki Nobuyoshi.",,,
Nakamura Haruko,2002,Her work 海からの贈り物 (The Gift from the Sea) is included in the group exhibition 写真新世紀10周年記念 (New Century of Photography - 10th Anniversary) held at the Tokyo Metropolitan Museum of Photography (Tokyo),,,
Nakamura Haruko,2005,Dies from pancreatic cancer,,,
Nakamura Haruko,2008,"Posthumous publication of the photobook 光の音 Pure and Simple (Sound of Light, Pure and Simple) (Formare la Luce)",,,
Seino Yoshiko,1995,"After working as a editor for several years, she starts taking photographs in her thirties",,,
Seino Yoshiko,1996,"Her first solo exhibition, Seino Yoshiko with Switch, is held at the Comme des Garcons main store in Aoyama, Tokyo",,,
Seino Yoshiko,1997,"She publishes the first two volumes of the photobook series Chicken Skin Photographs, a collaboration with the designer and art direector Ishizaki Kentaro (self-published). Initially five volumes were planned, but only the first three were ever realized",,,
Seino Yoshiko,1998,Publishes the third photobook in the collaborative Chicken Skin Photographs series with Ishizaki Kentaro (self-published),,,
Seino Yoshiko,1999,"Her solo exhibition, Emotional Imprintings, is held at Gallery Koyanagi (Tokyo)",,,
Seino Yoshiko,2002,Publishes the photobook The Sign of Life (Osiris),,,
Seino Yoshiko,2000,Her work is included in the group exhibition 反記憶-現代写真Ⅱ (Anti-memory: Contemporary Photography II) at the Yokohama Museum of Art (Yokohama),,,
Seino Yoshiko,2003,"Her first international solo exhibition, The Sign of Life, is held at the Wintertour Photo Museum (Wintertour, Switzerland)",,,
Seino Yoshiko,2008,"Her solo exhibition A Good Day, Good Time is held jointly at Gallery Trax (Yamanashi) and Punktum Photography (Tokyo)",,,
Seino Yoshiko,2009,"Her photobook, 至るところで 心を集めよ 立っていよ (Everywhere, Gather Yourself, Stand) (Osiris), is published shortly before her death",,,
Ara Taeko,1986,"Graduates from Komazawa University, Department of Japanese Literature",,,
Ara Taeko,1995,"In addition to her career as a poet, theater director, and painter, Ara begins studying photography",,,
Ara Taeko,2000,Wins the JPS Exhibition Bronze Award,,,
Ara Taeko,2004,"Is diagnosed with breast cancer and undergoes treatment, including a total right mastectomy and years-long hormone treatment. Much of her subsequent photography and her advocacy work focuses on issues of mortality, femininity, and healing as a result of this experience.",,,
Ara Taeko,2005,Holds her first solo exhibition 白い夏 (White Summer) at Roonee 247 Photography (Tokyo),,,
Ara Taeko,2006,"Holds two solo exhibitions for 胸 神 乳がんになった日から (munakami - from the first day of breast cancer) at Shinjuku Nikon Salon (Tokyo) and Osaka Nikon Salon (Osaka), and an additional solo exhibition, オリヒメの涙 (Tears of Orihime) at Roonee 247 Photography (Tokyo); Wins the 13th Domon Ken Cultural Award Encouragement Prize for her exhibition 胸 神 乳がんになった日から (munakami - from the first day of breast cancer)",,,
Ara Taeko,2007,"Holds two solo exhibitions:  √1, at Shinjuku Nikon Salon (Tokyo) and Trance at Roonee 247 Photography (Tokyo)",,,
Ara Taeko,2008,"The solo exhibition √1 travels to Osaka Nikon Salon (Osaka), and she holds a new solo exhibition, ILIS, at Nadar (Tokyo)",,,
Ara Taeko,2009,"Holds a special solo exhibition at the Atami City Sawada Seiko Memorial Museum (Atami City, Shizuoka Prefecture), entitled 胸 神 ( muna  kami )」-澤田政廣の彫刻に魅せられて (muna kami - entranced by the sculpture of Sawada Seiko)",,,
Ara Taeko,2013,"Her work is included in the group exhibition 酒田市土門拳文化賞２０周年記念写真展 -歴代受賞者による近作展 (Sakata City Domon Ken Culture Award 20th Anniversary Exhibition - Recent Works by Successive Winners), held at the Sakata Museum of Art (Sakata City, Yamagata Prefecture)",,,
Kanamori Mayu,1981,"Moves to Melbourne, Australia to study philosophy at Toorak College",,,
Kanamori Mayu,1989,"Moves to Sydney, Australia with her future husband, journalist Ben Hills",,,
Kanamori Mayu,1992,Temporarily moves back to Japan to take a job as a researcher at the Tokyo bureau of the Sydney Morning Herald newspaper,,,
Kanamori Mayu,1996,"Her first exhibition, Unseen Faces of Japan, is held at the Sydney chapter of the Japan Foundation (Sydney, Australia)",,,
Kanamori Mayu,2000,"Holds a solo exhibition in Japan in advance of the 2000 Sydney Olympics, entitled 素顔のオーストラリア (Australia Without Makeup) at Konica Plaza (Tokyo); She also debuts her first narrative work with The Heart of the Journey, a combination of still photography, audio narration, and performance. The audio portion of the project debuts on ABC Radio National (Australia)",,,
Kanamori Mayu,2005,"Produces Chika: A Documentary Performance, which combines photojournalism, live dance and performance, audio narration, and projection, and debuts at C.U.B. Malthouse (Sydney, Australia). The 2004 audio component of the project was a Walkley Awards finalist.",,,
Kanamori Mayu,2008,"Exhibits a collaborative photojournalism show with husband Ben Hills, The Island of the Ancients:    Photographs of Sardinia’s Centenarians at Custom House Library (Sydney,  Australia)",,,
Kanamori Mayu,2015,"Artist-in-Residence, Institute of Advanced Studies, University of Western Australia",,,
Kanamori Mayu,2016,"Artist-in-Residence for the Asian Collections, National Library of Australia",,,
Yoshitake Megumi,,Graduates from the Tokyo College of Photography in the department of journalism,,,
Yoshitake Megumi,1987,Travels to Syria and neighboring countries to begin photographing Bedouin culture,,,
Yoshitake Megumi,1995,Holds her first solo exhibition ベドウィン (Bedouin) at Minolta Photo Space (Tokyo/Osaka),,,
Yoshitake Megumi,2008,"Solo exhibition, BEDOUIN — A Simple Life A Traditional Life A Peaceful Life, at the Foreign Correspondant's Club of Japan (Tokyo)",,,
Yoshitake Megumi,2009,,,,
Yoshitake Megumi,2010,,,,
Yoshitake Megumi,2014,Publishes her first photobook ARAB - Bedouin of the Syrian Desert: A Story of a Family (SKIRA);,,,
Yoshitake Megumi,,,,,
Tsutsumi Ako,1983,"Studies abroad for a year in high school near Santa Cruz, California",,,
Tsutsumi Ako,1986,Graduates from Tokyo Polytechnic University junior college with a degree in photography,,,
Tsutsumi Ako,1987,"Travels to the United States for the second time, studying photography at the Brooks Institute of Photography and Cinematography",,,
Tsutsumi Ako,1996,"Returns to Japan, working first in a photo studio at Hotel Okura Tokyo, before returning to Kumamoto and joining the Tsutsumi Photo Studio family business",,,
Tsutsumi Ako,2002,"Recieves the Prime Minister's Award for her photographic portrait, Maria in a Hat",,,
Tsutsumi Ako,2014,Becomes the representative director of the Tsutsumi Photo Studio business,,,
Nakashima Hiromi,1988,"Graduates from Women's College, Meiji University with a law degree; begins working at Nikka Whiskey Compan",,,
Nakashima Hiromi,1990,"Travels to Eastern Europe following the fall of the Berlin Wall, photographing in Czechoslovakia, Hungary, and the former Yugoslavia",,,
Nakashima Hiromi,1994,Completes courses at Japan Photographic Academy,,,
Nakashima Hiromi,1997,"Holds her first solo exhibition, やわらかい時 (Soft Times) at Tokyo Photographic Culture Center (Tokyo)",,,
Nakashima Hiromi,2000,Solo exhibition 孔雀の視線 (Through the Eyes of a Peacock) at Tokyo Photographic Culture Center (Tokyo),,,
Nakashima Hiromi,2001,Graduates from Tokyo College of Photography; Wins the Grand Prix for the 17th Hitotsubo Exhibition,,,
Nakashima Hiromi,2002,"Begins career as freelancer; Holds solo exhibition ウララ・シンネ、ラヨチ・シンネ (URARA-SINNNE, RAYOTI-SINNNE) at Guardian Garden (Tokyo)",,,
Nakashima Hiromi,2005,Holds solo exhibition そして、深呼吸 (Breathing In) at Roonee 247 (Tokyo),,,
Nakashima Hiromi,2006,Solo exhibition 雪を待つ (Waiting for Snow) at Gallery Huit (Tokyo),,,
Nakashima Hiromi,2008,"Holds her first international solo exhibition, LIKE A MIST, LIKE A RAINBOW, at Galerija SULUJ in Belgrade, Serbia",,,
Nakashima Hiromi,2009,"Holds solo exhibition アメニアル (Amenial) at Gendai Heights, Gallery Den (Tokyo)",,,
Yanagi Miwa,1993,"First solo exhibition, WHITE CASKET, at Art Space Rainbow (Kyoto)",,,
Yanagi Miwa,2002,"Publishes My Grandmothers 001 (ArtBeat Publishers), and MIWA YANAGI GRANDDAUGHTERS (Shiseidō Gallery)",,,
Yanagi Miwa,2004,"Publishes MIWA YANAGI (Deutsche Bank), WHITE CASKET (Getsuyōsha), and 少女地獄極楽老女 (Darkness of Girlhood and Lightness of Aging) (Marugame Genichirō Inokuma Museum of Contemporary Art)",,,
Yanagi Miwa,2005,"Publishes 無垢な老女と無慈悲な少女の信じられない物語 (The Incredible Tale of the Innocent Old Lady and the Heartless Young Girl) (Hara Museum), and Madame Comet (Ōhara Museum)",,,
Yanagi Miwa,2007,"Publishes Fairy Tale 老少女綺譚 (Fairy Tale, The Tale of The Old Lady) (Seigensha), and Elevator Girls (Seigensha)",,,
Yanagi Miwa,2009,Publishes My Grandmothers (Tankōsha),,,
Yanagi Miwa,2019,Publishes 神話機械 (Myth Machines) (Hatori Shoten),,,
Hara Mikiko,1996,Wins the 13th Canon New Cosmos of Photography Award; is selected for the 8th Hitotsubo exhibition,,,
Hara Mikiko,1998,"Solo exhibition: Agnus Dei. Ginza Nikon Salon (Ginza, Tokyo)",,,
Hara Mikiko,1999,"Exhibition: プライベートルーム2 新世代の写真表現 (Private Room II: Photographs by a New Generation of Women in Japan). Contemporary Art Center, Art Tower Mito (Mito, Ibaraki)",,,April–June 1999
Hara Mikiko,2001,"Exhibition: うつろの製法 (How to Make a Void), Shinjuku Konica Plaza (Shinjuku, Tokyo) and The Third Gallery Aya (Osaka)",,,
Hara Mikiko,2006,"Exhibition:  私のいる場所 新進作家展 vol.4 ゼロ年代の写真論  (Absolutely Private: Contemporary Photography, vol 4 ). Tokyo Metropolitan Museum of Photography (Ebisu, Tokyo)",,,March–April 2006
Hara Mikiko,2009,"Exhibition: 写真の現在・過去・未来 昭和から今日まで (The Past, Present, and Future of Photographs, From Showa to Today). Yokohama Civic Art Gallery (Yokohama)",,,
Hara Mikiko,2017,Wins the 42nd Kimura Ihei Award for <i>Change</i>,,,
Nomura Sakiko,1994,Publishes 裸の部屋 (Naked Room) (Aat ROOM),,,
Nomura Sakiko,1995,Publishes 針のない時計 (A Clock Without Hands) (Hon no miyakosha) and    40 + 1 PHOTOGRAPHERS PIN-UP (match and company),,,
Nomura Sakiko,1997,Publishes 裸の時間 (Naked Time) (Heibonsha),,,
Nomura Sakiko,1999,Exhibition: 闇の音 (The Sound of Darkness) (Yamaguchi Prefectural Art Museum),,,
Nomura Sakiko,2000,Publishes 愛の時間 (Time of Love) (BPM),,,
Nomura Sakiko,2004,Publishes もうひとつの、きょうのできごと (co-authored) (Kawade Shobo Shinsha),,,
Nomura Sakiko,2005,Publishes tsukuyomi (match and company),,,
Nomura Sakiko,2006,Publishes 近藤良平 (Kondō Ryōhei) (match and company),,,
Nomura Sakiko,2008,Publishes ALL ABOUT Miyazaki Daisuke (Futabasha),,,
Nakano Aiko,1993,"Exhibition: ""Aiko Nakano Exhibition"" (Gallery ARIES, Tokyo)",,,
Nakano Aiko,1996,"""aiko nakano photo exhibition"" from TOKYO, to Tokyo """" (BEAMS TOKYO, Shibuya); ""aiko nakano photo exhibition"" (Gallery Art Graph, Ginza); ""PHOTO EXHIBITION NAKED Aiko Nakano / Mika Ninagawa"" (Gallery Hanabun, Yotsuya); ""SHUTTER & LOVE Exhibition"" (Sapporo); ""8th Photograph"" ""3.3㎡ Exhibition"" (Guardian Garden, Ginza); ""Aiko Nakano and Tetsuro Yokoyama Exhibition"" (P.A.P. FACTORY, Harajuku)",,,
Nakano Aiko,1997,"8th Photo ""3.3㎡ Exhibition"" Grand Prix Winner;  ""Life * Life * Life"" (Guardian Garden, Ginza); ""PHOTO EXHIBITION"" Visions ""PART1: NAKED EYES"" (PARCO GALLERY, Shibuya); ""Japanese New Generation Photographer Exhibition"" (COLETTE, Paris: France); 11th Great Namba Festival ""Female Photographer Exhibition"" (Former Seika Elementary School, Osaka)",,,
,1998,"""Tokyo Photo Month '98 Kaleidoscope -'90s Female Photographers"" (Shinjuku Park Tower Atrium, Shinjuku)",,,
Nakano Aiko,2000,"""Aiko Nakano Exhibition-"" Tatsuya Fujiwara Photobook persona ""Exhibition-"" (Gallery Iseyoshi B Venue, Ginza)",,,
Nakano Aiko,2004,"""Aiko Nakano Photo Exhibition"" Shonan Musicians """" (Gallery TEZZ, Roppongi)",,,
Nakano Aiko,2006,"""Aiko Nakano Exhibition: A Hundred Blue Roses"" (Gallery ART SPACE, Machida)",,,
Mogi Ayako,1992,Receives the Nobuyoshi Araki Award for Canon Photography of the New Century,,,
Mogi Ayako,2006,"Starts the Jupaju Company in La Corbières, Switzerland where she manages the ""Laboratoire Village Nomade"" art project.",,,
Mogi Ayako,2009,"Moves to an old elementary school on Awaji Island and founds the artist community ""Nomad Village"" with Werner Penzel and Misa Shimomura",,,
Matsumoko Noriko,1999,Awarded the 14th “Hitotsuboten” Photography Award Grand Prix,,,
Matsumoko Noriko,2000,Solo exhibition “Hatehashi” guardian garden,,,
Matsumoko Noriko,2007,"""rabbits” OPA gallery /Calo Bookshop&Gallery",,,
Matsumoko Noriko,2007,"Photobook ""Rabbit Jima"" (Hayakawa Publishing)",,,
Matsumoko Noriko,2009,“With Eyes of a Hare” Calo Bookshop&Gallery,,,
Matsumoko Noriko,2011,“Flower garden” OPA gallery,,,
Matsumoko Noriko,2012,"""With Eyes of a Hare” CROSSROAD GALLERY",,,
Honda Kana,1994,"Graduates from Kyoto Seika University, Faculty of Fine Arts, Department of Design, Department of Visual Communication Design",,,
Honda Kana,1995,Is awarded the Photo New Century of Photography Excellence Award,,,
Honda Kana,1999,Wins the Mio Photo Encouragement Award 99 Encouragement Award (Grand Prix),,,
Honda Kana,2000,Spiral Independent Creators Festival Semi-Grand Prix,,,
Honda Kana,2001,Awarded the Kyoto Contemporary Photographer Exhibition Excellence Award.,,,
Honda Kana,2002,"New Century of Photography 10th Anniversary Exhibition ""Featuring Power"" (Tokyo / Tokyo Metropolitan Museum of Photography)",,,
Honda Kana,2003,"Solo Exhibition ""Kokoro no Kyukatsu"" (Kyoto / Gallery Sowaka)",,,
Honda Kana,2005,"Solo Exhibition ""SUSABI"" (Paris, France / Galalie Hitomi bushi d'Eau)",,,
Honda Kana,2008,"Solo Exhibition ""Maps I Have"" (Osaka / Kaigandori Gallery CASO); Solo Exhibition ""Maps I Have"" (Kobe / STREET GALLERY)",,,
Hanayo,1996,Publishes Hanayome (Shinchosha),,,
Hanayo,2000,"“utsushiyumekuni”, PARCO GALLERY (Tokyo)",,,
Hanayo,2002,"“hanayo”, Palais de Tokyo (Paris)",,,
Hanayo,2008,Publishes MAGMA (AKAAKA Art Publishing),,,
Hanayo,2013,Publishes berlin (Getsuyosha),,,
Hanayo,2016,Publishes Tenko (Case Publishing),,,
Hanayo,2017,“hanayo III” Taka Ishii Gallery Photography / Film (Tokyo),,,
Hanayo,2021,"Publishes Hanayo’s Underworld: Half a Century (Kawade Shobo Shinsha, ).",,,
Noguchi Rika,1994,Graduates from Nihon University specializing in photography,,,
,1996,Wins the Grand Prize at New Cosmos of Photography in Kyoto,,,
Noguchi Rika,1997,Travels to New York on a fellowship from the Asian Culture Council,,,1997-1998
Noguchi Rika,1999,Is invited to be a guest artist at Rijksakademie in the Netherlands,,,
Noguchi Rika,2001,Publishes Tori o miru (P3 art and environment); MIMOCA'S EYE VOL. 1 (Marugame Genichirō Inokuma Museum of Contemporary Art),,,
Noguchi Rika,2004,"Publishes Kono hoshi (Hara Museum, Icon Gallery,",,,
Noguchi Rika,2005,In-between13 (EU-Japan Fest),,,
Noguchi Rika,2009,Publishes Hikari (The National Art Center); Taiyō (Izu Photo Museum),,,
Noguchi Rika,2012,Publishes Hikari wa mirai ni todoku (Izu Photo Museum),,,
Ninagawa Mika,1996,"Work is featured in Iizawa Kōtarō, Shutter & Love, which attempted to make sense of the work of women photographers in the 1990s",,,
Ninagawa Mika,1997,Graduates from Tamabi,,,
Ninagawa Mika,1998,Publishes 17 9 '97 (Metalogue),,,
Ninagawa Mika,1999,Publishes Baby Blue Sky (Metalogue),,,
Ninagawa Mika,2000,Publishes Sugar and Spice (Kawade Shobō Shashinsha) and   Tokyo in Colors (Kōshinsha),,,
Ninagawa Mika,2001,Wins the Kimura Ihee Award (shared w. Hiromix & Nagashima Yurie),,,
Ninagawa Mika,2001,Pink Rose Suite (Editions Treville),,,
Ninagawa Mika,2007,Makes her debut as feature-length film director with Sakuran,,,
Kawauchi Rinko,1993,"Graduates from Seian University of Art and Design, and begins working in the photography department of an advertisement company",,,
Kawauchi Rinko,1995,Accepted for the APA International Photography biennial art exhibition,,,
Kawauchi Rinko,1996,Begins her career as a freelance photographer,,,
Kawauchi Rinko,1997,Participates in the 9th Hitotsubo Exhibition's Photography Division Grand Prix,,,
Kawauchi Rinko,1998,First solo exhibition: Utatane,,,
Kawauchi Rinko,2002,Wins the 27th Kimura Ihei Photography Award for Utatane and Hanabi; also wins the Photographic Society of Japan novice award,,,
Kawauchi Rinko,2009,Recieves honourable mention for the Shiga Culture Award; also wins the Infinity Award for the arts division,,,
Kawauchi Rinko,2012,"Wins the 63rd Minister of Education, Culture, Science, Science and Technology novice award for the exhibition 照度あめつち影を見る (Illuminance - Ametsuchi - Seeing Shadows) (Tokyo Metropolitan Museum of Photography)",,,
Kawauchi Rinko,2013,Wins the 29th Higashikawa Domestic Artist Prize,,,
Kawauchi Rinko,,"Completes a photography course at the Royal College of Art in London; holds an exhibition titled Imagine Finding Me, which will be eventually exhibited in over 16 countries",,,
Otsuka Chino,2006,Publishes Imagine Finding Me (PUB?),,,
